post_id,platform,original_text,engagement_score,date_posted,tone,tags
EP0001,LinkedIn,"Just saw a LinkedIn Influencer with 'Organic Growth' written in the profile with 65K+ followers claiming that he can help you in growing your platform, copying the posts from other influencers.",90,2021-12-09,Professional,"Influencer, Personal Growth"
EP0002,Twitter,"Jobseekers, this one’s for you.
 Every application, every interview, every follow-up… the pressure is immense.
 And I know what you're thinking: Am I not good enough? 
 But let me tell you, this isn’t about you or your skills. It’s about a broken system where 60% of applicants never hear back. 
 Your mental health is not worth sacrificing for a system that doesn’t acknowledge your worth. 
 Please remember, taking care of yourself is the real priority. 
 Your dream job will come, but for now, breathe. 🌻",347,2021-03-24,Inspirational,"Mental Health, Job Search"
EP0003,LinkedIn,"Looking for jobs on LinkedIn is like online dating: Full of promises, but in the end, you’re just left ghosted.",109,2023-12-18,Humorous,"Online Dating, Job Search"
EP0004,LinkedIn,"LinkedIn scams be like: 'Congratulations, you've been selected for a role you didn’t even apply for!' 
 The catch? Pay Rs. 50,000 for the honor.",115,2023-07-02,Humorous,"Scams, LinkedIn"
EP0005,LinkedIn,"sapne dekhna achi baat hai,
lekin job ka sapna dekh ke 'interested' likhna,
yeh toh achi baat nahi hai na?",545,2021-04-08,Humorous,"Career Development, Job Search"
EP0006,LinkedIn,"Next time when I'll be reading some LinkedIn Influencer's story, I am starting from the last line.
If there's a link attached to it, it's most probably a fake one.
Saves me time!",188,2023-04-23,Casual,"Productivity, Time Management"
EP0007,Facebook,"Every time I poured my heart into 5-6 rounds of interviews and faced rejection, it felt like a punch in the gut. The sleepless nights, the endless preparation, all for nothing.

But looking back, I realize it wasn’t nothing. It was the Universe’s way of saying, “Not this one, something better is on the way.”

Every single time, I’ve been shown why that rejection happened.

Doors I thought I wanted to walk through were shut, only to have the right ones swing open.

The kind that aligned with my growth, my values, and my happiness.

At first, it stung. It hurt deeply. But now, when things don’t go as planned, I don’t panic.

I don’t question my worth. I sit back, breathe, and trust. The Universe knows.

I know there's another plan waiting. Something bigger, better, and just for me.

To anyone feeling the weight of rejection: trust that the closed doors are protecting you from something you can’t see right now.

Your path is being cleared for something even more beautiful.",206,2021-08-19,Inspirational,"Motivation, Job Search"
EP0008,Instagram,"To everyone who's still looking for a job...

I see you. I feel you. 💔

Every rejection email feels like a punch in the gut, and every 'We'll get back to you' sounds more like 'You'll never hear from us.'

But I want you to know, you're not alone in this. 🌸

According to a study, 80% of jobseekers struggle with anxiety and self-doubt during their search. It's normal to feel lost, but it's not the end.

Take breaks, breathe, and remember, this doesn't define you. Your worth is not tied to an offer letter. 💥

Your mental health matters more than any job.",899,2021-03-23,Inspirational,"Mental Health, Job Search"
EP0009,Facebook,"Sometimes, we forget that a company’s brand name doesn’t define someone’s talent. It’s easy to get caught up in the 'big company = big talent' mindset, but that's not always the case.

I’ve had the privilege of working with people from smaller companies (lesser known) who blow me away with their skills and dedication. They don’t need a fancy title or a famous brand behind them to prove their worth.

I've seen the other side too—people in top-tier companies feeling lost, overwhelmed, or stuck, even though the world sees them as 'successful'.

Let’s stop attaching someone’s value to the company they work for. Freshers especially need to hear this—skills are what matter, not the size of the company behind them.

At the end of the day, happiness and growth don’t come from a brand name, they come from doing what you love and constantly improving your craft.",166,2022-05-05,Inspirational,"Career Advice, Personal Growth"
EP0010,Twitter,"So when I left a toxic work environment, I told my manager a simple thing and felt so good 😯

I just said-

'Hope your son gets a manager like you.
I hope that the manager behaves the same way as you did with me.
Thank you.'

Now tell me 1 thing-

She always said that she was a great manager.
Why will she get offended?

I just told her that I wish her son would get a manager like she was.

If you felt bad, then that means you were a bad manager and now you know it. 80

If you feel good, then take it as a blessing for your son and you'll really want someone to treat your son/daughter in the same way.

She cannot be even angry with me else it'll prove that she was not a 'great' manager.

Muskan - 1
Manager - 0

Muskan -> Aura +100000000

(Fictional message unfortunately :(
)

Hope you all become the people that your sons/daughters will like to work under 🙏

There are a lot of bad people/things, bring a small change and break the chain :)",1111,2022-02-03,Humorous,"Professional, Humor"
EP0011,Facebook,"I am an AI Tools & ChatGPT Expert, and my salary package is 42 LPA.

Sounds familiar? If you’ve been on YouTube recently, I’m sure you’ve seen this ad at least 100 times. Now, I have just one simple question – Can someone please tell me which companies are hiring for this role and paying 42 LPA? Because I’m also considering a career switch! 😂

See guys, learning how to use a few AI tools won't magically get you a 42 LPA job. Selling courses isn’t wrong, but selling them by giving false hopes is. Just because someone tells you that learning how to use a few AI tools will instantly land you a high-paying job doesn’t make it true.

So, a humble request – don’t fall for these unrealistic promises. Invest in courses only to upskill yourself, not with the expectation of overnight success.
If anyone actually finds this 42 LPA AI Tools & ChatGPT Expert job, please let me know. I’ll also update my resume! 🤣",319,2021-06-28,Professional,"Career Development, AI Tools"
EP0012,Instagram,"People talk about writing on LinkedIn like it’s a formula.

Write about this + this.

And your posts will do well.

But what does 'well' even mean?

Lots of likes?
Lots of reach?
Lots of people seeing your post?

They don’t talk about the type of people liking it.
The kind of reach you’re getting.
The exact people seeing your post.

There’s a lot you can't control.
But there are things you can.

Defining what 'well' means for yourself is one of them.

Because someone else’s 'well' is not your 'well.'

If you’re blindly following, you don’t have an algorithm issue.

You have a strategy issue.

Because your strategy informs what you do.

And just as importantly, what you don’t do.

Your strategy will inform your positioning.

That in turn will shape your messaging.

And your messaging connects with....

Well…

Your customers.

Not just well. But really well.

---

Control the things you can and should.",200,2023-05-26,Professional,"Algorithm, Strategy"
EP0013,LinkedIn,"3 things a vacation with my parents taught me.

(This was the first time when just the 3 of us had gone for a holiday.
It turned out to be an awesome experience - much better than I had thought.)

Upon my return, the next day as I was meditating, I reflected on the 4 days, asking myself if there was anything new I figured about myself or them.

Here they are:

1. No amount of material success, social validation, professional growth or bank balance can match up to the feeling of pampering your parents and making them feel proud of who you have become.

Their pride when people asked me for selfies, the comfort in which we travelled and stayed - everything made them act like kids in a toy store.

Nothing makes a child happier than to see their parents experience this joy.

2. The number of such occasions with your parents is drastically reducing.

We walked for 5-8kms every day and by the end of the day, both of them were quite tired. They are both 70+, so it's a matter of a few years until such holidays come to a stop.

I wish I had started long ago :(

3. Your parents have lived their life and are set in their ways.
What they need now is not change.
What they need is acceptance.

I do not agree with everything that my parents say or do, and for the longest time, I thought it is my duty to change their ways.

I was wrong.

At this age, the best I can do is to accept them.

There isn't much time.

Call them, visit them, spend time with them, travel with them.

They do not need your money.
They need your time.

PS: Every week, I share such thoughts in my newsletter. You can receive that email for free by subscribing from the link in comments.",2454,2023-08-18,Inspirational,Family
EP0014,LinkedIn,"If you don't understand the value of retention you can't survive the Service industry.

But, why do people promote retention of clients?

Because it's proof of the quality of services you are providing.

I retained 50% of my clients to date.

Whenever I ask them about their expectations,

They end up saying 'We don't have to worry about this, we know the quality you offer.'

How do you retain clients?

ONE Formula

- never compromise with the quality you offer

Clients return for the experience.

As we say Experience>>>>>>>>>>

By creating content that resonates, I help B2B and B2C retain their customers.",16,2022-02-18,Professional,"Retention, Service, Quality, Business"
EP0015,Instagram,"I landed my dream tech job in the USA during a recession... without sending a single application!

Yep, you read that right. And no, it wasn't just luck.

Here’s how I made it happen:

I went all-in on making my LinkedIn profile stand out.

Every project I worked on? Posted it.

The impact it had? Documented it.

The problems it solved? Broke it all down.

Then I discovered my golden ticket - Kaggle competitions.

Instead of just participating, I started publishing in-depth notebooks breaking down complex ML problems into bite-sized pieces.

Each notebook told a story: the 'why' behind feature engineering, the reasoning for model selection, even the failed experiments.

I was solving real problems and teaching others along the way.

Before I knew it, people were actually engaging with my content, and guess who started sliding into my DMs? Hiring managers!",1400,2023-10-28,Professional,"LinkedIn, Job Search"
EP0016,Instagram,"Remote work is not just a trend; it's becoming the future of work. Many companies are adopting flexible working models, but challenges remain in maintaining productivity and collaboration. How do you ensure work-life balance while working remotely?",421,2023-04-23,Neutral,"Productivity, Remote Work"
EP0017,LinkedIn,人工智能正在颠覆各行各业，从医疗保健到金融，再到教育。虽然它带来了巨大的便利和效率，但也引发了关于隐私和就业的担忧。你认为人工智能会如何影响未来的工作市场？,387,2021-11-08,Neutral,"Artificial Intelligence, Job Search"
EP0018,Instagram,"घर से काम करने की सुविधा होने से क्या कर्मचारियों की उत्पादकता बढ़ती है या घटती है? कुछ लोग इसे अधिक लचीलापन देने वाला मानते हैं, जबकि कुछ का मानना है कि इससे ध्यान भटक सकता है। आपका क्या अनुभव है?",532,2021-04-28,Neutral,"Productivity, Employee"
EP0019,LinkedIn,"La transformación digital ha cambiado la forma en que operan las empresas. Desde la automatización de procesos hasta la integración de inteligencia artificial, cada sector está evolucionando. ¿Crees que las empresas deben priorizar la digitalización para seguir siendo competitivas?",289,2022-05-15,Professional,"Digitalization, Competitive"
EP0020,Instagram,L'innovation technologique joue un rôle clé dans le développement durable. L'intelligence artificielle et les énergies renouvelables offrent des solutions prometteuses. Comment pouvons-nous équilibrer innovation et protection de l'environnement?,415,2021-06-12,Professional,"Durable, Innovation"
EP0021,Twitter,الشمولية في بيئة العمل الحديثة أصبحت من أهم المواضيع التي تناقشها الشركات اليوم. من ضمان التنوع الثقافي إلى توفير فرص متكافئة، ما هي برأيك أفضل الطرق لجعل بيئة العمل أكثر شمولية وإنصافًا؟,368,2023-05-23,Neutral,"Work Environment, Diversity"
EP0022,LinkedIn,"বৈচিত্র্য এবং অন্তর্ভুক্তি শুধুমাত্র কর্পোরেট দুনিয়ার জন্যই গুরুত্বপূর্ণ নয়, এটি সমাজের জন্যও অপরিহার্য। কর্মক্ষেত্রে লিঙ্গ সমতা, সাংস্কৃতিক বৈচিত্র্য এবং প্রতিবন্ধীদের জন্য সুযোগ সৃষ্টির বিষয়ে আপনার কী মতামত?",272,2023-11-06,Professional,"Diversity, Corporate World"
EP0023,Twitter,"A sustentabilidade é uma prioridade para muitas empresas hoje em dia. Desde a redução da pegada de carbono até a adoção de práticas mais ecológicas, há muito a ser feito. Como sua empresa está contribuindo para um futuro mais sustentável?",329,2021-08-13,Neutral,Sustainability
EP0024,Instagram,Лидерство в современном мире требует устойчивости и гибкости. Кризисы и неопределенность стали нормой. Как лидеры могут развивать эмоциональную устойчивость и вдохновлять свои команды?,451,2023-12-18,Professional,"Leadership, Resilience"
EP0025,Twitter,العمل عن بعد أصبح حقيقة لا مفر منها. ولكن كيف نحافظ على التحفيز والتفاعل بين الزملاء عندما نعمل من منازلنا؟ هل تعتقد أن الاجتماعات الافتراضية فعالة بقدر الاجتماعات التقليدية؟,390,2023-06-27,Professional,"Virtual Meetings, Remote Work"
EP0026,LinkedIn,Hinglish: Sustainability kaafi important hai! Par kya hum apni daily life mein eco-friendly practices ko adopt kar rahe hain? Aap kya kar rahe hain pollution aur waste reduction ke liye?,498,2021-01-26,Neutral,"Eco-Friendly, Sustainability"
EP0027,Instagram,"AI is transforming healthcare at an unprecedented pace. From AI-driven diagnostics to robotic surgeries, technology is improving patient outcomes. However, concerns about data privacy and ethical implications remain. How do you think AI will shape the future of healthcare?",379,2022-05-03,Neutral,"Artificial Intelligence, Healthcare"
EP0028,Twitter,人工智慧技術正在進一步改善環境保護工作，例如透過數據分析減少碳排放、監測氣候變化等。你認為 AI 還可以在哪些方面幫助環境保護？,255,2023-12-11,Neutral,"Artificial Intelligence, Sustainability"
EP0029,Twitter,डिजिटल ट्रांसफॉर्मेशन के दौर में छोटे और मध्यम व्यवसायों को सबसे ज्यादा फायदा कैसे मिल सकता है? क्या सरकारी सहायता और टेक्नोलॉजी एडॉप्शन उन्हें कॉरपोरेट कंपनियों के मुकाबले खड़ा कर सकता है?,340,2023-08-13,Neutral,"Digital Transformation, Small Business"
EP0030,Facebook,"¿Cómo la inteligencia artificial está impactando la educación? Desde herramientas de aprendizaje personalizadas hasta evaluación automatizada, la tecnología está revolucionando el sector educativo. ¿Qué opinas sobre el uso de IA en la educación?",412,2021-05-05,Neutral,"Learning, Artificial Intelligence"
EP0031,Twitter,"L'intelligence artificielle pourrait-elle remplacer les emplois traditionnels? Bien que l'automatisation améliore l'efficacité, elle soulève des inquiétudes concernant l'emploi. Quelles compétences doivent développer les travailleurs pour rester pertinents dans un monde dominé par l'IA?",287,2023-09-18,Neutral,"Automation, Artificial Intelligence"
EP0032,Instagram,كيف يمكننا تحقيق تحول رقمي دون التضحية بالخصوصية؟ في عالم متصل بشكل متزايد، البيانات الشخصية أصبحت أكثر عرضة للاختراق. ما هي أفضل الممارسات لحماية الخصوصية في عصر التكنولوجيا المتقدمة؟,276,2023-10-14,Professional,"Privacy, Digital Transformation"
EP0033,Facebook,কোভিড-পরবর্তী যুগে স্বাস্থ্য সচেতনতা কতটা গুরুত্বপূর্ণ হয়ে উঠেছে? মানসিক এবং শারীরিক সুস্থতা নিশ্চিত করতে আমরা কোন নতুন অভ্যাসগুলি গ্রহণ করেছি?,334,2022-04-05,Neutral,"Post Covid Life, Health Awareness"
EP0034,Facebook,A liderança resiliente é fundamental para superar desafios econômicos e sociais. Como um bom líder pode manter a moral da equipe alta em tempos de crise?,415,2021-01-28,Professional,"Leadership, Resilience"
EP0035,LinkedIn,"Люди или технологии: что важнее для успешного бизнеса? Некоторые считают, что человеческий фактор всегда будет определяющим, другие же уверены, что автоматизация – это будущее. А что думаете вы?",390,2021-11-06,Neutral,"Business, Technology"
EP0036,Facebook,Hinglish: AI ka impact hamari jobs pe kaise padega? Kya aapko lagta hai ki automation naye opportunities create karega ya existing jobs ko replace karega?,540,2023-02-13,Neutral,"Artificial Intelligence, Job Search"
EP0037,Facebook,"Work-life balance is essential for mental well-being. With longer working hours and constant digital connectivity, burnout has become a real issue. How do you set boundaries to maintain a healthy balance?",471,2023-08-17,Professional,"Work-Life Balance, Mental Health"
EP0038,Instagram,數字創新如何幫助創業公司快速發展？從雲計算到區塊鏈，技術為初創企業提供了前所未有的機會。你認為哪種技術對創業最有幫助？,238,2023-01-22,Professional,Entrepreneurship
EP0039,LinkedIn,"क्या महिलाएँ कार्यस्थल पर समान अवसर प्राप्त कर रही हैं? भले ही लैंगिक समानता की दिशा में काफी प्रगति हुई है, फिर भी कई क्षेत्रों में अभी भी असमानता बनी हुई है। आपकी राय में क्या किया जाना चाहिए?",315,2023-09-25,Inspirational,"Diversity, Workplace"
EP0040,Instagram,"¿Es posible lograr un mundo sin contaminación? Desde el reciclaje hasta la energía renovable, hay muchas soluciones. Pero, ¿estamos realmente haciendo lo suficiente para abordar el problema ambiental?",502,2023-06-04,Inspirational,"Environmental Impact, Sustainability"
EP0041,Instagram,"Les énergies renouvelables sont-elles la solution au changement climatique? Le solaire, l'éolien et l'hydroélectrique gagnent en popularité, mais leur adoption reste limitée. Que faudrait-il faire pour accélérer leur utilisation?",428,2022-03-15,Neutral,"Climate Change, Sustainability"
EP0042,LinkedIn,كيف يمكن للذكاء الاصطناعي تعزيز الاقتصاد العالمي؟ من تحسين الكفاءة إلى خلق وظائف جديدة، الذكاء الاصطناعي لديه القدرة على تغيير المشهد الاقتصادي بالكامل. كيف ترى مستقبل الذكاء الاصطناعي في الاقتصاد؟,359,2023-12-09,Inspirational,"Economy, Artificial Intelligence"
EP0043,Twitter,"A automação pode criar mais empregos do que destruir? Embora muitas tarefas manuais estejam sendo substituídas, novas oportunidades surgem. Como podemos garantir que ninguém fique para trás?",375,2023-02-28,Neutral,"Automation, Job Creation"
EP0044,Instagram,"After numerous rejections, I discovered that every 'no' brings me closer to the right 'yes.' Embrace setbacks as lessons for future success. Let your failures guide you toward greater achievements.",320,2023-09-20,Inspirational,"Motivation, Success"
EP0045,Twitter,在数字时代，持续学习变得比以往任何时候都重要。面对不断变化的市场和技术，保持竞争力需要不断进步。你如何在职业生涯中保持学习的热情？,280,2021-06-25,Inspirational,"Learning, Career Development"
EP0046,Twitter,"Remote work has redefined traditional office culture. It challenges us to find innovative ways to connect, collaborate, and stay inspired despite physical distance. What strategies have you found effective?",410,2023-09-01,Professional,"Office Culture, Remote Work"
EP0047,Instagram,"विविधता और समावेशिता से भरी कार्यस्थल न केवल उत्पादकता बढ़ाती है, बल्कि नई सोच और समाधान भी पैदा करती है। क्या आप अपने कार्यस्थल में इस परिवर्तन को महसूस कर रहे हैं?",370,2022-01-04,Inspirational,Diversity
EP0048,Instagram,"La transformación digital es un viaje continuo, lleno de aprendizajes y desafíos. Cada paso hacia la innovación abre nuevas oportunidades y plantea preguntas. ¿Cuál ha sido tu mayor aprendizaje en este camino?",335,2022-04-02,Inspirational,"Learning, Innovation"
EP0049,Twitter,"L'importance de l'innovation dans le secteur de la santé ne peut être sous-estimée. Les technologies émergentes offrent des solutions révolutionnaires, mais posent également des défis éthiques. Quelle est votre perspective?",395,2023-02-03,Neutral,"Health Awareness, Innovation"
EP0050,Facebook,التحديات في عالم العمل الحديث تتطلب مرونة وتفكير مبتكر. كل يوم يحمل معه فرصة لتعلم شيء جديد وتحدي القيود التقليدية. كيف تواجه تحديات العمل اليومية في بيئة متغيرة؟,360,2021-09-25,Inspirational,"Career Development, Innovation"
EP0051,Twitter,প্রযুক্তির অগ্রগতি আমাদের জীবনে বিপ্লব ঘটিয়েছে। কর্মক্ষেত্রে নতুন প্রযুক্তির ব্যবহার সৃজনশীলতা এবং দক্ষতা বৃদ্ধিতে সহায়ক। আপনার কাজের ক্ষেত্রে প্রযুক্তির প্রভাব কেমন?,310,2021-11-16,Neutral,"Workplace, Technology"
EP0052,Twitter,"A sustentabilidade não é apenas uma meta ambiental, mas uma responsabilidade que devemos assumir coletivamente. Empresas e indivíduos podem fazer a diferença adotando práticas sustentáveis. Qual é a sua contribuição?",420,2022-09-28,Professional,"Responsibility, Sustainability"
EP0053,Facebook,"Успех в современном бизнесе требует постоянного обучения и адаптации к новым условиям. Какие навыки вы развиваете, чтобы оставаться конкурентоспособным в этом стремительно меняющемся мире?",380,2021-09-25,Professional,"Business, Success"
EP0054,Twitter,"Hinglish: Networking ka matlab sirf contacts banana nahi, balki ek dusre ke growth me contribute karna bhi hai. Aap apne network se kya naya seekh rahe hain, aur kaise apni journey ko enrich kar rahe hain?",440,2023-05-13,Inspirational,"Networking, Personal Growth"
EP0055,Instagram,"Digital transformation is reshaping industries globally, creating new paradigms in business strategy and operations. How are you leveraging emerging technologies to drive innovation and growth in your organization?",405,2022-09-15,Professional,"Digital Transformation, Emerging Technologies"
EP0056,LinkedIn,人工智能技术的迅速发展为各行各业带来了机遇与挑战。除了提升效率，如何确保数据安全和隐私保护成为了新的课题。你对未来的AI应用有何期待？,350,2021-04-03,Neutral,"Data Security, Artificial Intelligence"
